{
  "$schema": "https://json-schema.org/draft/2020-12/schema",
  "title": "Видеоматериалы",
  "type": "array",
  "items": {
    "type": "object",
    "required": ["id", "title", "url", "description"],
    "properties": {
      "id": {"type": "string"},
      "title": {"type": "string"},
      "url": {"type": "string", "pattern": "^https?://"},
      "description": {"type": "string"},
      "rights": {"type": "string"},
      "quotes": {"type": "array", "items": {"type": "string"}}
    },
    "additionalProperties": true
  }
}
