[
  {
    "id": "leonov-intro",
    "title": "Максим Леонов о продолжении перевода Рамаяны",
    "url": "https://www.youtube.com/embed/dQw4w9WgXcQ", 
    "description": "Переводчик рассказывает о принципах работы над поэтическим текстом и значимости проекта.",
    "quotes": [
      "Наша задача — не просто передать смысл, но сохранить дыхание и ритм санскритского подлинника.",
      "Рамаяна — это не только древний эпос, это живая традиция, которая должна звучать на русском языке достойно."
    ]
  }
]
